{
  "ingested_content_id": "ic_a1b2c3d4e5f60708",
  "source_type": "google_docs",
  "source_reference": "1BxiMVs0XRA5nFMdKvBdBZjgmUUqptlbs74OgvE2upms",
  "source_fingerprint": "a842c529f2438dd1a42820b8b0dcd111542e3231d825c9899a909890d6ee25ea",
  "title": "Why Local Businesses Need a Digital Marketing Strategy in 2026",
  "status": "ingested",
  "approval_state": "pending",
  "full_article_text": "Local businesses across every sector are discovering that a coherent digital marketing strategy is no longer optional. This article explores the core reasons small and mid-sized businesses benefit from investing in structured digital marketing, covering search visibility, social proof, and content consistency as the three pillars of sustainable growth.",
  "word_count": 49,
  "metadata": {
    "author": "editorial@digitallyconnected.net",
    "source_created_at": "2026-07-01T09:00:00.000Z",
    "source_modified_at": "2026-08-05T14:30:00.000Z",
    "source_revision_id": "ALm37BX9k2p",
    "source_url": "https://docs.google.com/document/d/1BxiMVs0XRA5nFMdKvBdBZjgmUUqptlbs74OgvE2upms/edit"
  },
  "created_at": "2026-08-07T10:00:00.000Z",
  "updated_at": "2026-08-07T10:00:00.000Z",
  "checksum": "ac677b0ad300c7c4db95246078552991b278fce82577797e55d4cd21e54c640a"
}
